<?xml version="1.0" encoding="UTF-8"?>
<!--
To change this template, choose Tools | Templates
and open the template in the editor.
-->

<menu
    xmlns:xsi='http://www.w3.org/2001/XMLSchema-instance'
    xsi:noNamespaceSchemaLocation='../xsd/navigation.xsd'>
    <url>nav/serie</url>
    <element>
        <name>LCTPC</name>
        <action>desconsolidacion.jsp</action>
    </element>
    <element>
        <name>INTERNET</name>
        <action>desconsolidacion.jsp</action>
    </element>
</menu>
