<?xml version="1.0" encoding="UTF-8"?>
<!--
To change this template, choose Tools | Templates
and open the template in the editor.
-->

<menu
    xmlns:xsi='http://www.w3.org/2001/XMLSchema-instance'
    xsi:noNamespaceSchemaLocation='../xsd/navigation.xsd'>
    <url>nav/almacen</url>
        
    <navbar>
        <home status="enabled"></home>
        <back status="enabled">../nav/principal</back>
        <foward status="disabled"></foward>
        <filter status="disabled"></filter>
        <new status="disabled"></new>
        <refresh status="disabled"></refresh>
        <save status="disabled"></save>
        <delete status="disabled"></delete>
        <send status="disabled"></send>
        <help status="enabled"></help>
        <information status="enabled"></information>
        <out status="enabled"></out>
    </navbar>
    
    <element>
        <name>Desconsolidaciones</name>
        <action>nav/serie</action>
    </element>
    <element>
        <name>Recepcion directa de buque</name>
        <action>nav/almacen</action>
    </element>
    <element>
        <name>Recepcion de ruta federal</name>
        <action>nav/serie</action>
    </element>
    <element>
        <name>Desconsolidacion a ruta federal</name>
        <action>nav/serie</action>
    </element>

</menu>
